[
  {
    "route": "/download-tube8-videos",
    "website": "tube8.com",
    "status": "web_download_verified",
    "extractor": "tube8-media-definition",
    "sample_url": "https://www.tube8.com/porn-video/193214781/",
    "last_tested_at": "2026-05-17T00:00:00Z",
    "last_result": {
      "ok": true,
      "title_found": true,
      "formats_found": 4,
      "best_format": "720p mp4 default / 1080p mp4 available",
      "notes": "MP4 and HLS variants found via Tube8 mediaDefinition endpoint."
    }
  }
]
